username,date,retweets,favorites,label,text,geo,mentions,hashtags,id,permalink
prempridas,2019-02-26 01:24,0,0,,คนส่วนใหญ่ของประเทศเป็น ตลาดล่าง แว๊น สก๊อย เยอะมาก เวลาเปิด Twitter จะรู้สึกว่าคนถกกันด้วยปัญญา แต่พออ่านคอมเม้นข่าว Line Today นี่เห็นความถ่อยชัดเลย และความเห็นหยาบๆก็ถูกโหวตบวกรัวๆ เห็นละเพลีย,,,,1100099119454904320,https://twitter.com/prempridas/status/1100099119454904320
chocoricocoa,2019-02-26 01:20,0,0,,ตลาดล่าง ไม่เกี่ยวกับฐานะเลยจริงๆ เกี่ยวกับพฤติกรรมล้วนๆ,,,,1100098238609117184,https://twitter.com/chocoricocoa/status/1100098238609117184
UFLBSS01,2019-02-26 01:19,0,1,,ไม่ค่อยอยากจะใช้คำนี้เท่าไหร่แต่ยิ่งอ่านยิ่งเห็นยิ่งเจอก็นึกออกอยู่แค่คำเดียว ตลาด ล่าง,,,,1100098003191324672,https://twitter.com/UFLBSS01/status/1100098003191324672
tftt_tornf,2019-02-26 01:17,0,0,,หมาหมู่สัสๆเลย พวกเหี้ย ตลาดล่าง ประชากรคุณภาพต่ำ! https:// twitter.com/Sn_Nueng/statu s/1099960202214817792 …,,,,1100097451199848451,https://twitter.com/tftt_tornf/status/1100097451199848451
chrno_charnox,2019-02-26 01:13,0,0,,เข้าใจอารมณ์คนภูมิใจที่เห็นคนในครอบครัวห่มผ้าเหลืองนะ แม้จะเป็นช่วงเวลาสั้นๆไม่ถึงวันก็ตาม ถ้าบ้านเราเจออะไรแบบนี้ก็เป็นทุกข์เหมือนกัน คนบวชก็ทุกข์ ทั้งๆที่ไม่ควรจะทุกข์ เพื่อนมาร ตลาดล่าง ทำเสียแท้ๆ พระท่านสึกมากก็เลิกคบไปนะ คนแบบนี้ไม่ควรเกาะผ้าเหลืองไปด้วยหรอก,,,,1100096543774859265,https://twitter.com/chrno_charnox/status/1100096543774859265
milkshakejp_,2019-02-26 01:07,0,0,,เราว่าไม่เกี่ยว ตลาดล่าง ไม่น่าคิดไปถึงจุดบาปบุญนะ มันคือความกระสันแล้วไม่มีเงินจะซื้ออุปกรณ์ป้องกันมากกว่า,,,,1100094943010250758,https://twitter.com/milkshakejp_/status/1100094943010250758
chrno_charnox,2019-02-26 01:06,0,0,,เออ อันนี้สงสารพระจริงๆ เขาตั้งใจจะบวช แต่มารในรูปแบบเพื่อน ตลาดล่าง ทำให้ได้บาปมากกว่าบุญ อันนี้อยากให้แยกประเด็นตรงนี้,,,,1100094743290101760,https://twitter.com/chrno_charnox/status/1100094743290101760
polkunx,2019-02-26 01:02,0,0,,พวกที่ด่า #หนูรัตน์ ก็คือกลุ่มคน ตลาดล่าง จำพวกนึง,,,#,1100093807373086720,https://twitter.com/polkunx/status/1100093807373086720
needirenen,2019-02-26 00:54,0,0,,ยุคของ ตลาดล่าง,,,,1100091775941697536,https://twitter.com/needirenen/status/1100091775941697536
baroqu_e,2019-02-26 00:53,0,0,,ตลาดล่าง หมายถึงพวกขยะสังคมมิใช่ฐานะ,,,,1100091428745535490,https://twitter.com/baroqu_e/status/1100091428745535490
baroqu_e,2019-02-26 00:52,0,0,,ส่องแท็กวัดสิงแล้วแบบ อิพวก ตลาดล่าง นี่มันหน้าหีจิงๆเลยค่ะ ดอกทอง อิเวน,,,,1100091261988495360,https://twitter.com/baroqu_e/status/1100091261988495360
fromlisa_th,2019-02-26 00:52,0,0,4,นายกจาก ตลาดล่าง รมต. ตลาดล่าง,,,,1100091219554623489,https://twitter.com/fromlisa_th/status/1100091219554623489
metineen,2019-02-26 00:50,0,0,,เกลียดการเหยียดโดยใช้คำว่า #ตลาดล่าง ที่นครปฐมมันคือชื่อตลาดนะ,,,#,1100090721657282561,https://twitter.com/metineen/status/1100090721657282561
MyLifeIsFinE80,2019-02-26 00:49,0,0,,มาตรการควบคุมสุนัขจรจัดมีแล้วควรคุมประชากร ตลาดล่าง ด้วยนะ พวกนี้ไม่ต่างจากหมาจรจัดแย่กว่าด้วยซ้ำ จิตสำนึกความเป็นคนไม่มี จะด่าว่าเหี้ยแม่งยังสงสารเหี้ยเลย! #ปทุมคงคา,,,#,1100090482632192000,https://twitter.com/MyLifeIsFinE80/status/1100090482632192000
SomSuk1998,2019-02-26 00:49,0,0,,ตลาดล่าง ไม่ใช่สถานที่ แต่เป็นสันดานส่วนบุคคล #วัดสิงค์ #pat5,,,# #pat5,1100090469894090752,https://twitter.com/SomSuk1998/status/1100090469894090752
MyLifeIsFinE80,2019-02-26 00:46,0,0,,ประเทศไทยควรให้ความสำคัญกับการคุมกำเนิดได้แล้ว ประชากร ตลาด ล่าง เพิ่มขึ้นทุกวัน ใครมีนโยบายควบคุมประชากร ตลาด ล่าง บ้างไหม จะเลือกเลย #ปทุมคงคา,,,#,1100089689044746240,https://twitter.com/MyLifeIsFinE80/status/1100089689044746240
Abigailz_FP,2019-02-26 00:46,0,0,,หมั่นหน้ามาก ไม่มีมารยาท คิลคนอื่นละพิมพ์ด่าว่าโง่ ตลาดล่าง มาก #ระบาย #rov pic.twitter.com/2HXplADvDY,,,# #rov,1100089543070429184,https://twitter.com/Abigailz_FP/status/1100089543070429184
Ongkarn,2019-02-26 00:44,0,0,,เรื่อง ป๊อบ ปองกูล ผมว่ามันเรื่องส่วนตัวเขา 3 คน จะยังไงเสีย เบื้องหลังเขาตกลงอะไรยังไงกันเรามิอาจรู้ได้ แต่ถามว่ามันแย่หรือเลวร้ายขนาดที่ต้องมาเดือดดาลกันขนาดนี้มั้ย? ผมคิดว่าไม่ ด่าไอ่พวกทำลายชาติโน่น อย่างเช่น กลุ่ม ตลาด ล่าง มาตีเด็กสอบ เสือดำ นาฬิกา เรือดำน้ำ ฯลฯ ที่เราควรสนใจ!,,,,1100089274857189376,https://twitter.com/Ongkarn/status/1100089274857189376
allmynana,2019-02-26 00:43,0,0,,พูดไว้กงนี้เรยนะคะ ถึงดิชั้นจาเพนภัยสังคมแต่ดิชั้นไม่ได้เพนในรูปแบบพวก ตลาดล่าง เพาะดิชั้นเพนมากกว่านั้น,,,,1100088936980897792,https://twitter.com/allmynana/status/1100088936980897792
Im_PRK_KYL,2019-02-26 00:39,0,0,,เลิกใช้คำว่าเยาวชน เพราะสิ่งที่ทำมันเกินกว่าจะยอมรับจริงๆ นี่ฉันต้องมาอยู่กับเศษเดนมนุษย์อย่างนี้เหรอ ขอบอกเลยนะว่าจับทำหมันเหอะทั้งคู่เลย อย่าเพิ่มประชากร ตลาด ล่าง อีก #ปทุมคงคา,,,#,1100087984395669504,https://twitter.com/Im_PRK_KYL/status/1100087984395669504
HarlyQP,2019-02-26 00:36,0,0,,ขอหัวร้อนกับอะไรพวกนี้ทีเถอะ ปกติเกลียด ตลาดล่าง อยู่แล้ว มาเจอข่าวแบบนี้ ใกล้ตัวมากด้วย คือ สันดานต่ำมาก,,,,1100087148642856961,https://twitter.com/HarlyQP/status/1100087148642856961
elevdecembxx,2019-02-26 00:33,0,0,4,อีวัยรุ่นเข้าไปต่อยนร.นี่มึงแบบตลาดล่างสัสๆ ตลาดล่าง เหี้ยๆโง่อีควายเสร่อสุด,,,,1100086517861511170,https://twitter.com/elevdecembxx/status/1100086517861511170
jayplusten,2019-02-26 00:33,0,0,4,มีพวก ตลาดล่าง มาแข่งรถที่หน้าบ้านอีกแล้วจร้าาาาาาาาา,,,,1100086334838820864,https://twitter.com/jayplusten/status/1100086334838820864
spkmind3,2019-02-26 00:28,0,0,,เข้าใจเพิ่มขึ้นนะนี่ ตลาดบน ตลาดล่าง อยู่ที่สันดานด้วย เฮ้อ คนไทยสื่อสารซับซ้อนขึ้นนิ https:// twitter.com/gina4cat/statu s/1099981272154165248 …,,,,1100085117924470786,https://twitter.com/spkmind3/status/1100085117924470786
KKrittasin,2019-02-26 00:23,2,0,,ดูข่าวอันธพาล #วัดสิงห์ และข่าวเด็กช่างแทงเด็ก #ปทุมคงคา แล้วนึกถึงตัวเองสมัยมัธยมที่ชอบตามเพื่อนไปตีกัน ยิ่งตีกันตอนช่วงคนเยอะๆยิ่งหลงตัวเอง โคตรเท่ โคตรเจ๋ง โดนจับก็ไม่รู้สึกผิด แถมภูมิใจด้วยซ้ำ พอโตมาวันนี้โคตรเกลียดเลย อยากด่ามัน ไอ้ขยะสังคม กระจอก #ตลาด ล่าง #ข่าววันนี้,,,# # # #,1100083932287004683,https://twitter.com/KKrittasin/status/1100083932287004683
wnc1212312121,2019-02-26 00:23,0,0,,ตลาดบนกินยาคุมค่ะ เพื่อป้องกันไม่ให้มีผลผลิตออกเป็น ตลาดล่าง,,,,1100083856030363653,https://twitter.com/wnc1212312121/status/1100083856030363653
zungwoonie,2019-02-26 00:20,0,0,,ตอนนี้ก็มีฟังlazyloxy p hot พวกแก๊งThe rapper ไรงี้ แต่ครั้งนึงเคยชอบRap is nowมากกกกกก แล้วก็ไม่ค่อบได้ฟังอีกเลยเพราะเหี้ยไรไม่รู้แล้วพอกลับมาฟังอีกมันรู้สึกแปลกๆอะเพราะพวก ตลาดล่าง เริ่มชอบมาฟังล้างแหละ ตอนนี้ก็พยายามเปิดใจอยู่;-;,,,,1100083045359480838,https://twitter.com/zungwoonie/status/1100083045359480838
privateblw,2019-02-26 00:19,0,0,4,ตลาดล่าง แบบล่างสัสๆ อีกนิดก็แกนโลกละ https:// twitter.com/gong_e7/status /1099951769210171392 …,,,,1100082947372150787,https://twitter.com/privateblw/status/1100082947372150787
Uanmakmak,2019-02-26 00:16,1,2,,เรื่องนี้ มีคำถามเยอะมาก -ทำไมกูต้องมาอยู่ร่วมโลกกับคนแบบนี้ด้วยวะ -ทำไมต้องมารับรู้เรื่องที่เกิดจากคนที่ไม่มีความคิด -ทำไมคนที่เค้าดีๆต้องมาเจออะไรเลวๆจากคน ตลาด ล่าง แบบนี้ด้วย! #วัดสิงห์,,,#,1100082104866500617,https://twitter.com/Uanmakmak/status/1100082104866500617
__fhso,2019-02-26 00:12,5,1,,ปกติเราไม่ค่อยพูดเพราะมันหดหู่ ไม่มีทางออกเท่าไหร่ ก้อแอบเข้าใจคนระบายอารมใส่คนตรงหน้าแบบด่าคนอื่น อิพวกไร้การศึกษา ตลาดล่าง ไรงี้นะ มันสบายใจกว่าจริงๆ นอกจากจะไม่หดหู่แล้วยังยกตัวเองให้ดูตลาดบนได้อีก อิจฉา อยากเลิกอินเรื่องไรงี้อะ ชีวิตน่าจะเหมือนอยู่บนเมฆสีทอง,,,,1100081140889612289,https://twitter.com/__fhso/status/1100081140889612289
bbxmyg,2019-02-26 00:11,0,0,,ต้องโทษพ่อแม่ด้วยป่ะ พวก ตลาดล่าง มักจะไม่มีเวลาสอนลูก,,,,1100080969061527552,https://twitter.com/bbxmyg/status/1100080969061527552
CLFNewnew,2019-02-26 00:07,1,0,,แก ฉันเป็นคนเดียวมั้ย ที่พอเสพข่าวพวกเด็กแว๊น ตลาดล่าง ไรงี้ละแบบหงุดหงิดมาก หัวเสียมาก อยากด่าๆๆๆเลยอ่ะ คือปัญหาสังคมมากเว่อร์ อยากให้พ่อแม่นางและพวกนางเมื่อมีโอกาสเกิดมาแล้วขอให้กินยาคุมเลิกผลิตประชากรที่ไร้คุณภาพและไม่มีสมองคิดสะที ฉันขอโทษถ้าข้อความมันดูเหยียดเพราะกูเมื่อยมาก,,,,1100079929067106304,https://twitter.com/CLFNewnew/status/1100079929067106304
godtogetther,2019-02-26 00:05,0,0,,แอคเค่อไปแล้ว 5 say to gu ตลาดล่าง 55555555555555555555555555555555555555555 pic.twitter.com/6C26Ukxky3,,,,1100079249292062721,https://twitter.com/godtogetther/status/1100079249292062721
cappufrape,2019-02-26 00:04,0,0,,ไม่ได้เรียนจ้า เลยโง่ ตลาดล่าง https:// twitter.com/chewygumyumyum /status/1099662697862295553 …,,,,1100079144778457089,https://twitter.com/cappufrape/status/1100079144778457089
Nattaa_Ducky,2019-02-26 00:03,0,0,,รีล่า ถูกค่ะ เพราะสังคมมันมีระดับแตกต่างกันไป ไม่ได้เหยียดระดับไหน แต่ต้องยอมรับว่า ตลาดล่าง มันเลวร้ายเกินกว่าจะให้ลูกต้องเจอแบบนั้น การซื้อสภาพแวดล้อมไม่ว่าจะบ้านหรือโรงเรียนดีๆให้ลูกจึงสำคัญกับเรามาก,,,,1100078767924375553,https://twitter.com/Nattaa_Ducky/status/1100078767924375553
jandishcham,2019-02-26 00:02,0,0,,ตั้งแต่ดู #/วัดสิงห์ มันก็จะหงุดหงิดนิดหน่อยที่ทุกอย่างมันยุ่งยากมากขึ้นเพราะคน ตลาดล่าง ของ ตลาดล่าง อีกที,,,#,1100078550474878981,https://twitter.com/jandishcham/status/1100078550474878981
_phosrie,2019-02-26 00:01,0,0,4,ตลาดล่าง ไม่ใช่ชนชั้น แต่เป็นมึงอีป้อม https:// twitter.com/mookusama/stat us/1099986258753798144 …,,,,1100078427091038208,https://twitter.com/_phosrie/status/1100078427091038208
MPhadungpanya,2019-02-25 23:59,1,0,,เอาผิดถึงที่สุด ให้พวก ตลาดล่าง มันสำนึกไปยันเหง้า / คนบอกกุแม่งไม่เลิกว่าพวกมัน กุบอกเลย คนแบบพวกมันยังเทียบไม่ติดกับคนในรร.วัดสิงห์แม้แต่สตางค์แดงเดียว #pat5,,,#pat5,1100077899514703874,https://twitter.com/MPhadungpanya/status/1100077899514703874
BbearCchick,2019-02-25 23:56,0,0,4,อิข่าวเด็กอาชีวะที่แทงเด็กม.6อ่ะ นั่นน่ะตย. ตลาดล่าง ที่แท้จริง,,,,1100076974649700353,https://twitter.com/BbearCchick/status/1100076974649700353
vtamin4me,2019-02-25 23:55,3,1,,กรณีของ #ปทุมคงคา ก็ด้วย มันสะท้อนความไม่มีคุณภาพด้านความคิดของประชากรได้เลยอ่ะ แล้วเป็นปชก.ในระดับใกล้เคียงกันด้วย จะพยายามมอบทุนยื่นสวัสดิการให้ขนาดไหนแต่มีปชกที่มีความคิดพฤติกรรม ตลาดล่าง แบบนี้รบ.ไหนๆก็กุมขมับเพราะมันมีมากกว่าคนที่คิดได้แบบเราๆ,,,#,1100076941317566466,https://twitter.com/vtamin4me/status/1100076941317566466
kifkeewPattanee,2019-02-25 23:54,4,5,,โชคดีที่แม่เก่ง แม่ดุ แม่ตี แม่ห้าม แม่สอน พ่อแม่พาทำดี โชคดีที่โตมาไม่เป็น “ ตลาด ล่าง ” การเลี้ยวดูของพ่อแม่ก็เป็นส่วนหนึ่งที่จะทำใหัคนเป็นคนดี ไม่ใช่เลี้ยงหมือนลูกเทวดา #วัดสิงห์,,,#,1100076604951126016,https://twitter.com/kifkeewPattanee/status/1100076604951126016
WKA_Ofo,2019-02-25 23:53,0,0,,ผู้นำก็เจ๊ง บุคคลากร( ตลาด ล่าง )ก็เจ๊ง การศึกษา(เด็กช่าง) ก็เจ๊งอีก ประเทศนี้ไปใหญ่แล้ว,,,,1100076353125113856,https://twitter.com/WKA_Ofo/status/1100076353125113856
paiwanrat,2019-02-25 23:52,3,2,,ผิดเป็นบ้างปะวะละอายบ้างไหมอ่ะถามจริงๆเห็นอยู่ตำตาหรือนี่เป็นวิธีแก้(ตัว)ปัญหาของคน ตลาด ล่าง ? #วัดสิงค์ #วัดสิงห์ https:// twitter.com/thairath_news/ status/1099712857300643845 …,,,# #,1100076155082698763,https://twitter.com/paiwanrat/status/1100076155082698763
orange_kamon,2019-02-25 23:52,0,0,,ประชากร ตลาดล่าง กำลังครองประเทศแล้วมั้งเนี่ย มีแต่ข่าวพวกตลาดล่าง แม่งน่ากลัว คือใช้ชีวิตอยู่ดีๆก็อาจตายไม่รู้ตัว ทำไมรู้สึกไม่ปลอดภัยในชีวิตจัง คือไม่อยากมีลูกอยู่แล้ว แล้วเจอแบบนี้ยิ่งไม่อยากเลยจ้า ต้องโทษใครอ่ะ ผิดที่พ่อแม่ การศึกษา หรือว่าสิ่งแวดล้อมรอบตัว,,,,1100076107317964801,https://twitter.com/orange_kamon/status/1100076107317964801
Tnscrw,2019-02-25 23:46,0,0,,ประหารมันไปเหอะ set zero พวก ตลาดล่าง พวกนักเรียนนักเลงไปให้หมด,,,,1100074672496898048,https://twitter.com/Tnscrw/status/1100074672496898048
here_kuen_rung,2019-02-25 23:46,0,0,,ตลาดล่าง,,,,1100074531308236800,https://twitter.com/here_kuen_rung/status/1100074531308236800
jinyoungjaebjs,2019-02-25 23:45,0,0,,คอซองโง่+ ตลาดล่าง,,,,1100074322876452864,https://twitter.com/jinyoungjaebjs/status/1100074322876452864
dumbnotallowed,2019-02-25 23:45,0,0,,สิ่งที่น่ากลัวกว่าคนโง่คือคนโง่ที่ไม่รู้ตัวว่าโง่ น่ากลัวกว่านั้นคือคนไม่รู้ตัวว่าโง่แถมยังคิดว่าตัวเองฉลาด น่ากลัวที่สุดคือคนกลุ่มนี้ให้และรับคำแนะนำซึ่งกันและกัน และร่วมนำหายนะมาสู่สังคม #ตลาด ล่าง #savemefromtheshit,,,# #savemefromtheshit,1100074199576588288,https://twitter.com/dumbnotallowed/status/1100074199576588288
KKrittasin,2019-02-25 23:44,21,10,,ได้ข่าวว่าตอนนี้แกงค์อันธพาลงานบวชโดนฝากขังที่ศาลอาญาธนบุรีแล้ว และถูกคัดค้านประกันตัวด้วย ดีเหมือนกัน อยากให้ถูกขังยาวๆข้ามปีไปเลย แค่งานบวชยังแสดงความต่ำขนาดนี้ ถ้าวันสงกรานต์จะต่ำขนาดไหน #วัดสิงห์ #ความรู้สึกของวันนี้ #pat5 #ป๊อบปองกุล #ตลาด ล่าง,,,# # #pat5 # #,1100074135143669760,https://twitter.com/KKrittasin/status/1100074135143669760
jenoleehunt_,2019-02-25 23:44,0,0,,ถึงผมจะไม่ใช่คนดีมากแต่ก็ไม่ได้ ตลาดล่าง ขนาดนั้น,,,,1100074104143568896,https://twitter.com/jenoleehunt_/status/1100074104143568896
rinlyns,2019-02-25 23:43,0,0,,ปะเทศไทยคือไรอะคนในประเทศ(เน้นว่าไม่ใช่ทุกคน)บางกลุ่มหรือบางส่วนโง่เง่าล้าหลังดักดานและ ตลาดล่าง มากๆ นี่ต้องมาอยู่ในประเทศที่ต้องพูดคำว่าอิหยังวะอีกี่ล้านรอบกันอะ ประชากรในประเทศลางคนก็ทำตัวเถื่อนถ่อยต่อยต่ำระยำช้ามากจากใจจริง เดี๋ยวไปแทงเขาไปฆ่าเขาด้วยมูลเหตุใดยังมิทราบ,,,,1100073926636404736,https://twitter.com/rinlyns/status/1100073926636404736
itzaddddd,2019-02-25 23:41,0,0,4,ไอ้ตัวลูกก็คือ ตลาดล่าง ในอนาคตนั่นแหละ,,,,1100073384266760193,https://twitter.com/itzaddddd/status/1100073384266760193
itzaddddd,2019-02-25 23:41,0,0,4,ก็ไม่อยากจะเหยียดพวกเด็กแวนซ์นะเว้ยแต่มันก็เหี้ยจริงๆ นั่นแหละ ตลาดล่าง เหมาะละคำนี้ รักกัน เยกัน ท้อง แต่งงาน ทะเลาะกัน เลิกกัน มีผัวใหม่ บลาๆๆ,,,,1100073201273430017,https://twitter.com/itzaddddd/status/1100073201273430017
Maneephan_P,2019-02-25 23:40,0,0,,Defend ได้ห่วยแตกมาก #ตลาดล่าง จริงๆ https://www. facebook.com/10000011669218 8/posts/3201438843203307/ …,,,#,1100073025439854592,https://twitter.com/Maneephan_P/status/1100073025439854592
