username,date,retweets,favorites,label,text,geo,mentions,hashtags,id,permalink
aoywaramporn,2019-02-25 20:42,0,0,,อายุกันไม่ใช่น้อยๆเลยนะ ยังคิดกันไม่เป็นเลยหรอ ตลาดล่าง https:// twitter.com/amethyst_nn/st atus/1099856553702649856 …,,,,1100028260161736704,https://twitter.com/aoywaramporn/status/1100028260161736704
simonsayedok,2019-02-25 20:41,0,0,,เป่าปากเรียกแม่งมึงหรอ อีพวก ตลาดล่าง,,,,1100027970125611008,https://twitter.com/simonsayedok/status/1100027970125611008
pspp1832,2019-02-25 20:40,1,2,,เห็นแต่ละคนแล้วรู้สึกขยะแขยง ทั้งการกระทำ ที่มาของคำว่า ตลาดล่าง ที่แท้ทรู ไม่รู้จะหาคำไหนมาด่า ต่ำตมที่สุด นี่คือจุดต่ำสุดของสปีชีร์อะ ไม่น่าเกิดมาเลย อิพวกสวะสังคม #วัดสิงห์,,,#,1100027730484064256,https://twitter.com/pspp1832/status/1100027730484064256
xxxxswagggg,2019-02-25 20:40,0,1,,dna ตลาดล่าง,,,,1100027693028978689,https://twitter.com/xxxxswagggg/status/1100027693028978689
Nz_Eragon,2019-02-25 20:40,0,0,,รู้เลยว่าเป็นคนแบบไหน ทุกคำที่พิมพ์มานั้นได้ถูกกลั่นจากจิตใต้สำนึก หรือ สันดาน ของเค้า อย่าเอาตัวเองไปเปรียบเทียบกับคนที่โดนเลย จิตใจเค้าไม่ได้ ตลาด ล่าง ไร้ยางอายแบบคุณหนิ ก็อยากรู้เหมือนกันว่าคุณโตมาในสังคมสภาพแวดล้อมแบบไหนถึงได้คิดเรื่องต่ำได้ขนาดนี้ pic.twitter.com/Ry3YcAKJVM,,,,1100027652377796608,https://twitter.com/Nz_Eragon/status/1100027652377796608
minikimtae,2019-02-25 20:39,1,0,,เบื่อข่าวคน ตลาดล่าง,,,,1100027448542937088,https://twitter.com/minikimtae/status/1100027448542937088
l3elles_,2019-02-25 20:35,0,3,,กูงงว่าทำไมผู้หญิงยังทนวะ คือโปรไฟล์ก็ดี เป็นกูเทไปนานละ ไม่เข้าใจ ไม่เข้าใจทากๆ,,,,1100026527385669632,https://twitter.com/l3elles_/status/1100026527385669632
talovelas_2543,2019-02-25 20:35,0,0,,ท้อใจไทยเเลนด์แดน ตลาดล่าง มาก,,,,1100026407617359872,https://twitter.com/talovelas_2543/status/1100026407617359872
me_itppangg,2019-02-25 20:33,0,1,"2,4",อีควาย ควายมาก มากจนแบบอิดอกกูไม่รู้จะด่าไงดี กล้าถามได้ไงวะทำไมต้องสอบวันนี้ เค้าต้องถามมึงมากกว่ามาบวชควยไรวันนี้ มาหงายการ์ดไม่รู้จัก Gat-Pat โง่มาโง่เหี้ยๆโง่จนแบบมึงโตมายังไงวะไอสัส เด็กป.2 แถวบ้านกูแม่งยังรู้จักเลย เบื่ออิพวก ตลาด ล่าง จริงๆ สวะ! #PAT5 #วัดสิงห์,,,#PAT5 #,1100026104578887682,https://twitter.com/me_itppangg/status/1100026104578887682
_sky08xxxxxxxx,2019-02-25 20:33,0,0,,ตลาดล่าง ยังอายเลยมั้ยอะ #วัดสิงห์,,,#,1100025893261520898,https://twitter.com/_sky08xxxxxxxx/status/1100025893261520898
nongwornhawarn,2019-02-25 20:32,0,1,,หดหู่กับข่าว ตลาดล่าง ทุกข่าวเลยเอาจริงแบบ ชีวิตมึงฟัคอัพทุกอย่างแล้วแม้กระทั่งระบบความคิดและศีลธรรม,,,,1100025864744361984,https://twitter.com/nongwornhawarn/status/1100025864744361984
aphichaihi,2019-02-25 20:32,0,0,,ตลาดล่าง ไม้ใช่สถานที่ แต่เป็นผู้คน #วัดสิงห์,,,#,1100025851867947009,https://twitter.com/aphichaihi/status/1100025851867947009
MT_BB_markbam,2019-02-25 20:32,0,0,,ตลาดล่าง มากๆ,,,,1100025807974457344,https://twitter.com/MT_BB_markbam/status/1100025807974457344
nongwornhawarn,2019-02-25 20:32,0,0,,มีเงินแค่พอฐานะปานกลางก็ไม่กล้ามีลูกแล้วนะ ต้องรวยอ่ะส่งลูกไปอยู่ให้ไกลจาก ตลาดล่าง ที่สุด,,,,1100025646971928576,https://twitter.com/nongwornhawarn/status/1100025646971928576
AzeliaOey,2019-02-25 20:32,4,9,,อ่านเรื่อง #วัดสิงห์ ยังหัวอุ่นอยู่เลย ละแบบ ที่เค้าด่า ตลาดล่าง ก็สมควรละ พวก ตลาดล่าง ไม่อยากจะเหยียด แต่ความสำนึกความสลด ไม่มี แล้วก็กล้าขิงเนอะ เนอะ น๊อตทอง 70 บาท กินข้าวในห้าง โทษนะ น๊อตมึง ยังไม่ได้ชาเย็นกูแก้วนึงเลยจริงจังงงง,,,#,1100025626344312832,https://twitter.com/AzeliaOey/status/1100025626344312832
RomeoJAE,2019-02-25 20:30,0,0,,แก เราเหมือนแก หัวเสียสุด ปกติเราไม่อยากเหยียดใคร แต่นี่คือ ตลาดล่าง จริงๆ คือตรรกกะความคิดเหมือนอยู่คนละโลกกับเรา ควรคุมกำเนิดจริงๆ,,,,1100025332067840000,https://twitter.com/RomeoJAE/status/1100025332067840000
lalitapornn,2019-02-25 20:30,0,0,,ด่าเหี้ยยังสงสารเหี้ยอ่ะ ตลาดล่าง https:// twitter.com/jajarlalah/sta tus/1099971160693854208 …,,,,1100025284693127170,https://twitter.com/lalitapornn/status/1100025284693127170
9695dy,2019-02-25 20:29,4,0,,ตลาดบน ตลาดล่าง ตลาดซ้าย ตลาดขวา ตลาดหน้า ตลาดหลัง ตลาดพร้อมๆกัน!,,,,1100025030786707458,https://twitter.com/9695dy/status/1100025030786707458
gaipdst,2019-02-25 20:29,0,0,,ตลาดล่าง ไม่ได้วัดที่มูลค่าของเงิน,,,,1100025014491856896,https://twitter.com/gaipdst/status/1100025014491856896
ton_monster29,2019-02-25 20:26,0,0,,ตลาดล่าง ที่กูหมายถึงก็คือพวกเศษมนุษย์ พวกไร้สมองที่คิดไตร่ตรองผิดชอบชั่วดีด้วยตัวเองไม่เป็น พวกสัตย์ที่ไร้เซลสมองไร้งี้ #ตลาดล่าง,,,#,1100024344137261056,https://twitter.com/ton_monster29/status/1100024344137261056
sphiiinx_,2019-02-25 20:26,0,1,,ตลาดล่าง ไม่ใช่ฐานะ แต่เป็นสันดาน #วัดสิงห์,,,#,1100024257839431680,https://twitter.com/sphiiinx_/status/1100024257839431680
Yakuza_cmi,2019-02-25 20:26,0,8,,"ถ้าคน ตลาดล่าง คือพวกป่าเถื่อน​ ตลาดบนคือพวกมีสติปัญญา​ แล้วคนที่เรียกหรือด่าคนอื่นว่าพวก ตลาดล่าง "" เขาเป็นคนประเภทไหนกัน?""",,,,1100024193083568128,https://twitter.com/Yakuza_cmi/status/1100024193083568128
Memory_short,2019-02-25 20:26,0,0,,ชุดนักศึกษาที่ใส่ไม่ได้ช่วยยกระดับสมอง ใส่แค่ดูเท่ห์ว่าฉันได้เป็นนักศึกษาล่าแต้มไปวันๆ แต่น้องยังคิดได้แค่นี้ อย่าเรียนเลยเปลืองเงินพวกเฒ่าหัวงูที่หาเงินมาให้หล่อน รู้สึกอายเเทนพ่อแม่จริงๆ ตลาดล่าง,,,,1100024154676387841,https://twitter.com/Memory_short/status/1100024154676387841
boywud,2019-02-25 20:26,0,0,4,แล้วประเด็นคือมึงต้องมาทำร้ายร่างกายนักเรียนกับครูเหรอ อี ตลาด ล่าง อีต่ำ ขอยาดเหยียด,,,,1100024134929530881,https://twitter.com/boywud/status/1100024134929530881
xncky_,2019-02-25 20:25,0,0,,ตลาดล่าง มากเวอร์,,,,1100024044840116224,https://twitter.com/xncky_/status/1100024044840116224
AL_NTM,2019-02-25 20:25,0,0,,ตลาดล่าง สำหรับฉัน ฉันเจอแล้ว,,,,1100023998841118720,https://twitter.com/AL_NTM/status/1100023998841118720
iwahnper,2019-02-25 20:25,0,0,,"ปัจจุบันมันกลายเป็นประเพณี ที่เวลามีงานบวชต้องกินเหล้า ต้องจ้างรถแห่เครื่องเสียง ขอแค่อย่าสนุกเสียงดังจนเกินไปทำให้เกิดความรำคาญ อย่าสร้างความเดือดร้อนแก่ผู้อื่น จัดงานบวชเพื่ออะไรกันแน่? เพื่อความบันเทิงหรืออะไรยังไง ตรรกะเพี้ยนๆ  ตลาด ล่าง ไม่ใช่สถานที่ แต่เป็นผู้คน""",,,,1100023920759996429,https://twitter.com/iwahnper/status/1100023920759996429
Oxygen_totz,2019-02-25 20:22,0,0,,มีอะไรคืบหน้าคดีอีพวก ตลาดล่าง บ้าง #วัดสิงห์,,,#,1100023340247375872,https://twitter.com/Oxygen_totz/status/1100023340247375872
luckytofame,2019-02-25 20:22,0,0,4,ไม่ได้จะเหยียดนะ แต่อีพวก ตลาดล่าง วัดสิงห์นี่ทะลุถุงยางตลาดนัดมาเกิดหรอวะจิตใจถึงได้ต่ำตมแบบนี้อะ,,,,1100023296488177664,https://twitter.com/luckytofame/status/1100023296488177664
Baemunbae,2019-02-25 20:22,0,0,,ตลาดล่าง ไปถึงนรกเลย,,,,1100023107866120194,https://twitter.com/Baemunbae/status/1100023107866120194
Alitsarah,2019-02-25 20:21,0,1,,ทวิตที่ขำกับรูปร่างหน้าตาเขา มุกควายเกี่ยวกับรูปร่างหน้าตาเขา คือทวิต ตลาด ล่าง ! #ป๊อบปองกุล #ป๊อบปองกูล,,,# #,1100023056926306306,https://twitter.com/Alitsarah/status/1100023056926306306
mmsppxx,2019-02-25 20:21,0,0,,พวก ตลาดล่าง,,,,1100022910054363136,https://twitter.com/mmsppxx/status/1100022910054363136
iiGunAri,2019-02-25 20:20,0,0,,ตลาดล่าง คือนิสัย สันดาน การกระทำ ความคิดต่ำๆ ไม่ต้องเอาเรื่องเงินมาอวด รำคาญ,,,,1100022750456963073,https://twitter.com/iiGunAri/status/1100022750456963073
ppllwwhh,2019-02-25 20:18,0,0,,"มึงก็เสือกเหมือนกันแหละ ถ้าไม่เสือกมึงจะเข้ามาเจอทวิตกูหรอ ดักควายชิหาย 55555 Your birth certificate is an apology letter from Durex"" ฉลาดนักก็แปลให้ออกนะ พอละ คุยกับพวก ตลาดล่าง เปลืองแบตชิบหาย""",,,,1100022237048954880,https://twitter.com/ppllwwhh/status/1100022237048954880
frozenelsa06,2019-02-25 20:18,9,7,,ตลาดล่าง คือ ตลาดล่าง จริงๆอ่ะ ต่อให้ใครพูดใครอบรมพวกมันยังไงลงโทษขนาดไหน...ก็ไม่สามารถขุดความคิดแย่ๆของคนพวกนี้ออกมาได้เลย #วัดสิงค์ #งานบวชที่อัปมงคลที่สุด,,,# #,1100022167243186176,https://twitter.com/frozenelsa06/status/1100022167243186176
Ssrypp1,2019-02-25 20:17,0,0,,ตลาดล่าง เยอะไปปะ อีพวกนี้ไม่รักนวลสงวนตัวเลยเห้อออ กระหรี่ชัดๆ,,,,1100021957712523271,https://twitter.com/Ssrypp1/status/1100021957712523271
Youra45941261,2019-02-25 20:17,0,2,,ไม่รู้จักความหมายเเล้วคุนมึงยังกล้าโพสสมที่เป็น ตลาดล่าง,,,,1100021942558457857,https://twitter.com/Youra45941261/status/1100021942558457857
kimnarayoung,2019-02-25 20:15,16,10,,ช่วยกันดูหน่วย เข้าข่าย ตลาดล่าง ไหม ถามอะไรก็ไม่รู้ เปลืองภาษีประชาชน #วัดสิงค์ #pat5 #เลือกตั้งปี62 https:// twitter.com/mookusama/stat us/1099986258753798144 …,,,# #pat5 #,1100021512365436928,https://twitter.com/kimnarayoung/status/1100021512365436928
fmuicnkt,2019-02-25 20:15,0,0,,โทษนะคะ แต่อ่านแล้วจะอ้วก พวกมึงดูจริงจังกับการเป็น ตลาดล่าง มืออาชีพชิบหาย https:// twitter.com/jeanxmha/statu s/1099870998701035520 …,,,,1100021476164481025,https://twitter.com/fmuicnkt/status/1100021476164481025
sameeyukorea,2019-02-25 20:14,0,0,,หรือ ตลาดล่าง นั่นเอง,,,,1100021179790680070,https://twitter.com/sameeyukorea/status/1100021179790680070
Chalermpon1126,2019-02-25 20:14,0,0,,จะหัดรึเล่นนานก็เรื่องของกูพิมด่ามึงได้ละกัน ตลาดล่าง หีแตดไร มึงจะมาซื้อปลาเค็มให้แม่มึง???,,,,1100021168025694208,https://twitter.com/Chalermpon1126/status/1100021168025694208
aomneedsprivate,2019-02-25 20:12,0,0,,กูว่าสทศ.ฟ้องร้องค่าเสียหายเอาเงิน ยังไงมันก็มีจ่าย กูรู้สึกว่ามันมีตังกันกูว่ามันรวยๆกัน แต่ที่ ตลาดล่าง คือสันดานและไร้การศึกษาอ่ะ แค่เรียกเก็บเงินกูว่ามันไม่พอ,,,,1100020823220318208,https://twitter.com/aomneedsprivate/status/1100020823220318208
Me_my_memolody,2019-02-25 20:11,0,0,,สังคมแบบคน ตลาดล่าง นั้นแหละค่ะ,,,,1100020458282409985,https://twitter.com/Me_my_memolody/status/1100020458282409985
_ceeyutagain,2019-02-25 20:11,0,0,,ตลาดล่าง ไม่ใช่สถานที่แต่คือผู้คน,,,,1100020412971245568,https://twitter.com/_ceeyutagain/status/1100020412971245568
ppllwwhh,2019-02-25 20:09,0,1,,ส้นตีนพ่อมึงสิ กลับหลุมมึงไปเลยค่ะ อีพวก ตลาดล่าง หัดเล่นทวิตเตอร์,,,,1100020047685120001,https://twitter.com/ppllwwhh/status/1100020047685120001
beztsh_,2019-02-25 20:09,0,0,,ตลาดล่าง มากแม่ https:// twitter.com/MMMMMayja/stat us/1099740889709080577 …,,,,1100020032954806274,https://twitter.com/beztsh_/status/1100020032954806274
agubgib,2019-02-25 20:09,0,0,,เราเอาอะไรวัดใ่าคนคนนี้เป็น ตลาดล่าง คนนี้ตลาดบน แล้วเราอยู่ตรงไหนอ่ะ,,,,1100019990646841350,https://twitter.com/agubgib/status/1100019990646841350
Scala73089761,2019-02-25 20:07,0,1,,ตลาดล่าง ไม่ได้หมายถึงเงินทอง แต่หมายถึงสันดาร #ตลาดล่าง,,,#,1100019445328531456,https://twitter.com/Scala73089761/status/1100019445328531456
MmPorcupine,2019-02-25 20:06,0,3,,บางทีก็แอบกลัวว่านับวันพวกประชากร ตลาดล่าง เนี่ยคิดเป็นกี่เปอร์เซ็นต์ของพลเมืองทั้งหมดกลัวมันมากจนเรากลายเป็นพลเมืองกลุ่มน้อยแล้วเราจะขับเคลื่อนประเทศยังไงอะถ้า ตลาดล่าง มากขนาดนี้ #วัดสิงค์,,,#,1100019254265446401,https://twitter.com/MmPorcupine/status/1100019254265446401
namwarn93,2019-02-25 20:05,2,0,,นี่แหละตัวอย่างของ #ตลาดล่าง ที่แท้ทรู #วัดสิงห์ https:// twitter.com/xxmytbxx/statu s/1099898462064132097 …,,,# #,1100018860722253824,https://twitter.com/namwarn93/status/1100018860722253824
rtxghq,2019-02-25 20:04,39,14,,ก็ที่สอบๆกันเนี่ย โตไปทำงาน ก็จ่ายภาษีมาจุนเจือพวก ตลาด ล่าง ได้สวัสดิการตั่งต่างอย่างพวกมึงไง #วัดสิงห์,,,#,1100018639820906496,https://twitter.com/rtxghq/status/1100018639820906496
TookHow,2019-02-25 20:03,0,0,,คือชนชั้นของคนพวกนั้นต่ำยิ่งกว่า ตลาด ล่าง อีกค่ะ,,,,1100018457288929286,https://twitter.com/TookHow/status/1100018457288929286
beardyslam,2019-02-25 20:03,2,1,,ตลาดล่าง นี่ไม่มีถุงยางขายสินะครับ #Pat5 #วัดสิงห์,,,#Pat5 #,1100018328968384512,https://twitter.com/beardyslam/status/1100018328968384512
patsachonn,2019-02-25 20:02,0,0,,ตลาดล่าง ไม่ได้หมายถึงฐานะ,,,,1100018301655076864,https://twitter.com/patsachonn/status/1100018301655076864
natdaneww,2019-02-25 20:01,3,0,,ใครว่ายังโอม ตลาดล่าง มาเดี่ยวกะกูเหอะ,,,,1100017995990978560,https://twitter.com/natdaneww/status/1100017995990978560
QueridoOsw,2019-02-25 20:01,12,11,,พักเรื่องพี่ #ป๊อบปองกุล กันก่อน แล้วดันเรื่อง #วัดสิงห์ ให้ขึ้นเทรนด์ดีกว่าค่ะ พี่ป๊อปเค้าอาจจะทำร้ายจิตใจผญ.สองคน แต่ไอ้พวกสันดาน ตลาด ล่าง ที่ไปทำลายอนาคตของน้องๆ มันเรื่องระดับประเทศเลยนะ,,,# #,1100017992094498816,https://twitter.com/QueridoOsw/status/1100017992094498816
iporr,2019-02-25 20:01,0,0,,คือไม่เกี่ยวกะมีเงินปะ การกระทำ ความรู้สึก​นึกคิด จิตสํานึก​ของพวกมึงต่างหาก​ที่ ตลาด​ล่าง https:// twitter.com/PpThati/status /1099927685587886080 …,,,,1100017971777351681,https://twitter.com/iporr/status/1100017971777351681
paxda_,2019-02-25 20:01,0,3,,อนาคตประเทศชาติ จบลงด้วยน้ำมือพวก ตลาดล่าง ! #วัดสิงห์,,,#,1100017823051464704,https://twitter.com/paxda_/status/1100017823051464704
ppokpangfanptan,2019-02-25 20:00,1,0,,สมองก็ ตลาดล่าง ด้วยนะไม่โง่นี้แคปนี้ไม่ได้นะ5555,,,,1100017714658078722,https://twitter.com/ppokpangfanptan/status/1100017714658078722
J___Peace,2019-02-25 19:58,0,0,,ข่าวเหี้ยอะไรกันวะ กูเครียด ตลาดล่าง สุด,,,,1100017114289627138,https://twitter.com/J___Peace/status/1100017114289627138
pn_1203,2019-02-25 19:58,0,0,,หนักใจวะ แชทไลฟ์rov ตลาดล่าง สุดๆ ไม่ด่าก็ขอเอา ต้องเปงคนแบบไหน,,,,1100017080869412864,https://twitter.com/pn_1203/status/1100017080869412864
korala54,2019-02-25 19:57,0,1,,นี่แหละคงรู้แล้วเนอะว่าคนมีการศึกษากับ ตลาดล่าง มันต่างกันตรงไหน #วัดสิงห์ #pat5,,,# #pat5,1100017061063868416,https://twitter.com/korala54/status/1100017061063868416
ynptt15,2019-02-25 19:57,0,0,,How to แก้ตัวแบบ ตลาดล่าง เขาทำกัน~ https:// twitter.com/Fanta48484665/ status/1099843205015556096 …,,,,1100016915391467520,https://twitter.com/ynptt15/status/1100016915391467520
Somrizzy,2019-02-25 19:56,2,0,,เอาจริงป่ะ การอยู่ปาเทดเหี้ยๆ นี่ยิ่งทำให้กุวางแผนชีวิตได้ง่ายขึ้นอ่ะ อนาคตคือมองให้ใกล้เข้ามา เอาความสุขช่วงสั้นๆ พอ เพราะวางแผนยาวไปอาจจะอยู่ไม่ถึง วันดีคืนดีอาจจะตายเพราะเจอพวก ตลาด ล่าง มาฟัน มาถล่มตอนนั่งสอบ หรือไม่ก้เป็นมะเร็งปอด เอาเป็นว่าไม่ต้องวางแผนไกล เดี๋ยวก็ตายละ,,,,1100016560641433600,https://twitter.com/Somrizzy/status/1100016560641433600
status9397,2019-02-25 19:51,1,2,,เหนื่อยใจกับพวก ตลาดล่าง . . . #วัดสิงห์ pic.twitter.com/PUUOif4jZH,,,#,1100015436786069507,https://twitter.com/status9397/status/1100015436786069507
kkboiofhirodai,2019-02-25 19:51,0,0,,ตลอดล่างที่แท้จริงคือสังคมที่เกลียด ตลาดล่าง ที่ตนเป็นผู้สร้าง ... สงสารนะ สมเพชด้วย #วัดสิงห์,,,#,1100015329583878144,https://twitter.com/kkboiofhirodai/status/1100015329583878144
puiszz,2019-02-25 19:48,1,1,,นี่นึกถึงนโยบายเกิดปั๊บรับแสนของบางพรรคเลย ถ้าทำขึ้นมา พวก ตลาด ล่าง เกิดกันพรึ่บพรั่บแน่ อยากให้มีนโยบาย ทำหมันฟรีแล้วให้เงินคนพวกนี้ น่าจะช่วยสังคมได้มากกว่า #มัธยมวัดสิงห์ #เลือกตั้งปี62,,,# #,1100014622608842753,https://twitter.com/puiszz/status/1100014622608842753
dpskinhead,2019-02-25 19:48,1,1,,"ความหมายของ  ตลาดล่าง "" เนี้ย ใช่ชั้นใต้ดินของตลาดป่าวอ่ะ แบบที่น้ำที่เศษเนื้อจาก ร้านขายเนื้อขายปลาขายผัก ไหลลงไปกองๆรวมๆกันเป็นกอง #วัดสิงห์""",,,#,1100014562319855621,https://twitter.com/dpskinhead/status/1100014562319855621
Introve24865980,2019-02-25 19:47,0,0,,การแต่งตัวความคิด ตลาดล่าง,,,,1100014540069072898,https://twitter.com/Introve24865980/status/1100014540069072898
