username,date,retweets,favorites,label,text,geo,mentions,hashtags,id,permalink
pemieiei,2019-02-25 17:24,12,6,,เอาเป็นว่าพี่กินข้าวมื้อนึงนี่แพงกว่าน๊อตทองแว๊นของน้องนะคะ กระเป๋าพี่1 ใบก็ซื้อมอไซด์แว๊นของน้องได้คันนึงอ่ะ เก็บเงินซื้อน๊อตไว้เป็นค่าเทอมเรียนหนังสือพัฒนาสมองและคุณภาพชีวิตบ้างนะจ๊ะ #ตลาดล่าง #วัดสิงห์ #pat5 https:// twitter.com/tidmoodeedee/s tatus/1099968419888168960 …,,,# # #pat5,1099978550977822721,https://twitter.com/pemieiei/status/1099978550977822721
Bambam19931,2019-02-25 17:24,3,0,,ผช.ผบ.ตร กำลังหาทางยื่น ข้อหา อั้งยี่ ซ่องโจรให้แก๊ง ตลาด ล่าง #วัดสิงห์,,,#,1099978483587928064,https://twitter.com/Bambam19931/status/1099978483587928064
jjjxno,2019-02-25 17:22,0,0,,ถ้าเขา ตลาดล่าง ก็อย่าลงไปด่ากับเขาเลย,,,,1099977846611537922,https://twitter.com/jjjxno/status/1099977846611537922
NammonJV,2019-02-25 17:21,0,1,,เคยคิดเอาไว้ว่าในอนาคตมนุษย์เราจะมีแต่คนฉลาด สวย หล่อ เพราะมีพฤติกรรมแบบเลือกคู่ผสมพันธุ์ (Non random mating) ที่จะทำให้ลักษณะที่ไม่ถูกเลือกหายไปเรื่อยๆ แต่ตอนนี้ต้องคิดใหม่ เพราะชนชั้น ตลาด ล่าง ของเรายังมีพฤติกรรมแบบไม่เลือกคู่ผสมพันธุ์(Random mating)อยู่ คงจะไม่สูญพันธ์ง่ายๆ,,,,1099977706123419650,https://twitter.com/NammonJV/status/1099977706123419650
poy48p,2019-02-25 17:21,0,0,,ตลาดล่าง ที่แท้,,,,1099977642030227456,https://twitter.com/poy48p/status/1099977642030227456
ingsdx,2019-02-25 17:20,0,0,,ตลาดล่าง มาก ทุเรศ,,,,1099977359015333888,https://twitter.com/ingsdx/status/1099977359015333888
greenleafforB,2019-02-25 17:19,0,1,,ตลาดล่าง ที่แท้ บอลเตะกันที่อังกฤษ แต่พี่ไทยเดือดอะไรอะ รูปเกมส์คือชวนง่วงมาก พวกมึงอินอะไรก๊านนนนนนนนนนนน pic.twitter.com/nAh4SvWpo7,,,,1099977260004663296,https://twitter.com/greenleafforB/status/1099977260004663296
mluAQ0eEchU5RoB,2019-02-25 17:19,2,0,,อีคนเป็นแบ็คให้ต้องตรวจสอบมันด้วยนะอีตำรวจที่ทำคดีหายด้วย อีพวกนี้กมทำไรไม่ได้ตลอดก็คือศาลเตี้ยมันไม่ดีก็จริงแต่กับอีพวกนี้ควรเจอ อยู่ไปก็รกโลกต่ำหยะแหยงว่ะเหม็นสาบคนจน เหม็นกลิ่น ตลาด ล่าง #วัดสิงห์,,,#,1099977188403601408,https://twitter.com/mluAQ0eEchU5RoB/status/1099977188403601408
mokzVIP,2019-02-25 17:18,0,0,,สังคม ตลาดล่าง ดูที่มันฟัคอัพอยู่ตอนเนี้ย มันก็เป็นเพราะรัฐไง แบบตามหลักมันไม่มีใครบอร์นอีวิ่วอะ เราถ้าอยุ่ในสังคมแบบนั้นเราก็คงเป็นแบบนั้นเหมือนกัน รัฐลงไปทำอะ ต่อให้ไม่ให้ความร่วมมือยังไง รัฐมีอำนาจบังคับเหนือประชาชน ก็บังคับเข้าไปสิ แล้วเดี๋ยวประชากรลูบหน้าก็มีคุณภาพขึ้นเอง,,,,1099976954155954179,https://twitter.com/mokzVIP/status/1099976954155954179
smileymaii,2019-02-25 17:17,0,0,,เห็น ตลาดล่าง ต่ำๆตมๆแล้วก็นึกถึงตัวเองถ้าตอนเด็กที่ยายจะเอาไปเลี้ยงแล้วแม่ไม่ดื้อเอากูไว้เลี้ยงเอง สภาพสังคมแถวนั้นคือยังไงกูก็ไม่รอด ยังไงกูก็สก๊อย ยังไงก็ไม่เรียน,,,,1099976784630542336,https://twitter.com/smileymaii/status/1099976784630542336
chanruja,2019-02-25 17:17,0,0,,ตระกูล ตลาดล่าง ที่เเท้ทรู,,,,1099976775126274048,https://twitter.com/chanruja/status/1099976775126274048
zammtime1111,2019-02-25 17:15,13,3,,อันนี้จริงมากอ่ะ คือทำไม ตลาด พวกนี้ ถึงมีลูกง่ายลูกดกดีจัง พวกที่พร้อมๆ มีเงินมีปัญญา คือมีลูกยากเหลือกัน ตลาด ล่าง นี่ออกลูกโดยการวางไข่หรอ คว่ำตายไปหลายศพ แต่ก็ไม่เคยสูญพันธุ์ #วัดสิงห์ https:// twitter.com/nnutqy/status/ 1099649673042612225 …,,,#,1099976260027965440,https://twitter.com/zammtime1111/status/1099976260027965440
iFuckBie,2019-02-25 17:14,16,9,,ชื่อ #ชาติสยาม แต่สันดาร #ชาติหมา #PAT5 #วัดสิงห์ #ตลาดล่าง pic.twitter.com/NS71uBknsQ,,,# # #PAT5 # #,1099975905932304384,https://twitter.com/iFuckBie/status/1099975905932304384
PpThati,2019-02-25 17:14,0,0,,พอเอาสันดานมาวัดแล้วก็ได้รู้ว่าคำว่า ตลาดล่าง ก็สูงเกินไปสำหรับคนแบบนี้,,,,1099975850869411841,https://twitter.com/PpThati/status/1099975850869411841
blossomJ_,2019-02-25 17:13,0,0,,ตลาดล่าง ไม่ใช่สถานที่ แต่เป็นผู้คน,,,,1099975789833969664,https://twitter.com/blossomJ_/status/1099975789833969664
NoppPunya,2019-02-25 17:13,3,1,,"ช่วงนี้มีแต่ข่าวแรงๆ กระทบต่อจิตใจทั้งนั้น ต้องทำตามเจ๊มาช่าเขาบอกนะครับ..อย่าอินเกิน"" จะได้ไม่เครียดเกิน #วัดสิงห์ #pat5 #ตลาด ล่าง pic.twitter.com/uOgklCe5pP""",,,# #pat5 #,1099975715586371585,https://twitter.com/NoppPunya/status/1099975715586371585
Panda_Chubby_,2019-02-25 17:12,50,11,,ฟังสัมภาษณ์จบละนี่เป็นคนนึงที่ใจอ่อนอ่ะ รู้สึกว่าพี่ #ป๊อบปองกูล แกเป๋ไปแล้วจริงๆอ่ะ ชีวิตเสียศูนย์ไปแล้ว ไม่ได้บอกว่าไม่ผิดนะ ผิด แต่ไม่ด่าแล้ว เพราะเค้ารู้ตัวแล้วว่าเค้าผิด จะเก็บแรงไปด่าพวก ตลาดล่าง #วัดสิงห์ มันยังบอกครูล้มเอง ไม่ได้บุกเข้าไปถามเฉยๆอยู่ มันยังไม่สำนึก,,,# #,1099975493988769798,https://twitter.com/Panda_Chubby_/status/1099975493988769798
BarbieDef_K,2019-02-25 17:12,0,0,,ถ้า ตลาดล่าง เท่ากับเงิน คือดิฉันตลาดใต้ดินเลยจ้ะ,,,,1099975367945707520,https://twitter.com/BarbieDef_K/status/1099975367945707520
Mrnew2300,2019-02-25 17:12,0,0,,ตลาดล่าง เยอะจัง ไทยแลนด์,,,,1099975328229818368,https://twitter.com/Mrnew2300/status/1099975328229818368
kwangnttpp,2019-02-25 17:11,1,0,,ตลาดล่าง ของจริง https:// twitter.com/sn_nueng/statu s/1099960202214817792 …,,,,1099975229529440256,https://twitter.com/kwangnttpp/status/1099975229529440256
hinoki_0921,2019-02-25 17:11,0,0,,กูละโมโห กับอิพวก ตลาดล่าง ตรรกะของคนพวกนี้แบบต่ำตมรกโลกมาก กูต้องหายใจร่วมโลกกับคนแบบนี้ไปถึงเมื่อไหร่,,,,1099975148751355904,https://twitter.com/hinoki_0921/status/1099975148751355904
whitie0611,2019-02-25 17:10,0,0,,นี่กูต้องอยู่ร่วมโลกกับพวกขยะสังคม พวกสวะ ตลาดล่าง จริงดิ,,,,1099974921524924416,https://twitter.com/whitie0611/status/1099974921524924416
kikyeol_1995,2019-02-25 17:10,0,0,,ตลาดล่าง นี่มัน ตลาดล่าง จริงๆอยากรู้ชื่อเฟสว่ะ https:// twitter.com/patongko98/sta tus/1099877814243753984 …,,,,1099974876310339591,https://twitter.com/kikyeol_1995/status/1099974876310339591
pmttpby,2019-02-25 17:09,0,0,,อย่าสนใจแต่สนุกดิ คุณสนุกแต่คนที่เขาต้องทำเพื่ออนาคตของเขาอะ?? คือ ตลาด ล่าง มันก็ ตลาด ล่าง จริงๆอะ แย่อะ แย่มาก เพราะแบบนี้รึเปล่า ประเทศถึงไม่เจริญสักทีอะ??,,,,1099974680641847297,https://twitter.com/pmttpby/status/1099974680641847297
pang_nunnaphat,2019-02-25 17:09,1,1,,ยิ่งได้เห็นคลิปวงจรปิดแล้ว มึงนะมึงงงงง ไร้สามัญสำนึก eqต่ำ ตลาด ล่าง โมโห #วัดสิงห์,,,#,1099974632839376896,https://twitter.com/pang_nunnaphat/status/1099974632839376896
babe_kkkkkk,2019-02-25 17:08,0,0,,หือ คิดว่าเค้าด่า ตลาดล่าง เพราะจนเหรอ ถึงรีบมาอวดมารวยอะ555555 จะบอกให้จ้าว่า ตลาดล่าง เค้าไม่ได้วัดที่ฐานะ เค้าวัดกันที่สันดาน,,,,1099974417239527424,https://twitter.com/babe_kkkkkk/status/1099974417239527424
ahnrifoi,2019-02-25 17:05,0,0,,ตลาดล่าง ไม่ได้ดาคนที่ไร้การศึกษา เเต่ใช้ด่าคนที่ไร้มารยาทอย่างมึงไง อิหน้าสัส,,,,1099973590722564097,https://twitter.com/ahnrifoi/status/1099973590722564097
heightsos,2019-02-25 17:04,0,0,,-บินไปนู้นนี้นั่นบ่อยมากครับ เป็นคนไม่ชอบประเทศไทยด้วยหลายๆเหตุผล ทั้งผู้นำ ตลาดล่าง ขยะสังคม และอื่นๆอีกมากมาย,,,,1099973389236658176,https://twitter.com/heightsos/status/1099973389236658176
dadddum_,2019-02-25 17:04,0,0,4,คือชาว ตลาดล่าง นี่อวดรวยกันใหญ่ อีน็อตหนึ่งตัวเท่ากับข้าวในห้างนี่โคตรดิ้นรน จานไม่ถึงร้อย อีควาย,,,,1099973314494099456,https://twitter.com/dadddum_/status/1099973314494099456
dadddum_,2019-02-25 17:02,0,0,,ตอนเห็นโพสนี่โคตรขำ คือจะอวดสูงอ่ะ แต่สุดท้ายก็เหมือนเดิม ตลาดล่าง เหมือนเดิม,,,,1099972979679612928,https://twitter.com/dadddum_/status/1099972979679612928
babe_kkkkkk,2019-02-25 17:02,0,0,,แล้ว ตลาดล่าง ไม่ได้ขึ้นอยู่กับฐานะวยจนจ้า เค้าดูกันที่สันดาน,,,,1099972890483580928,https://twitter.com/babe_kkkkkk/status/1099972890483580928
waennniie,2019-02-25 17:02,0,0,,เมื่อก่อนชั้นเรียกว่ามนุษย์ลิง เดี๋ยวนี้เปลี่ยนมาเรียก ตลาดล่าง แล้วกัน ง่ายกว่า https:// twitter.com/kittykapuklook /status/1099832201787596800 …,,,,1099972843985526791,https://twitter.com/waennniie/status/1099972843985526791
Satangy,2019-02-25 17:01,0,0,,ผู้ชาย ตลาดล่าง มักสะเหล่อผิดที่ผิดทาง กระจอกซ้ำซาก.,,,,1099972717191737349,https://twitter.com/Satangy/status/1099972717191737349
juoonkung,2019-02-25 17:01,1,1,,มึง!!!!!ไปมุดหัวในหีเมียมาอ่ออออไอ้สัสเค้าออกข่าวเลื่อนสอบแจ้งวันสอบกันใหญ่โต มึงนั่นแหละวันๆเคยเปิดทีวีดูข่าวมั้ย????? #ตลาดล่าง ควรเพิ่มสอนสกิลการแถนะคะไม่ไหวโง่ไปผี!!!! #วัดสิงห์ https:// twitter.com/nokkaewyak/sta tus/1099676105353584640 …,,,# #,1099972691421843458,https://twitter.com/juoonkung/status/1099972691421843458
bbanthisk,2019-02-25 17:00,0,0,,ถ้าคน ตลาดล่าง จะเยอะขนาดนี้...,,,,1099972492179820544,https://twitter.com/bbanthisk/status/1099972492179820544
GolfKorkot,2019-02-25 17:00,0,0,,ตลาดล่าง,,,,1099972489399005184,https://twitter.com/GolfKorkot/status/1099972489399005184
PackBlink,2019-02-25 17:00,4,2,,เอาตูดฉีกอ่ะ เผื่อพวก ตลาดล่าง มันจะสำนึกได้ว่าประเทศนี้ยังมีขื่อมีแปอยู่นะพวกมึงจะมาทำตัวเป็นมนุษย์ถ้ำล่าแมมมอธแดกไม่ได้ #วัดสิงห์ https:// twitter.com/Zprezzatura/st atus/1099953056861417472 …,,,#,1099972311661273089,https://twitter.com/PackBlink/status/1099972311661273089
juoonkung,2019-02-25 16:58,3,2,,ดีนะให้มันได้รู้ซะมั่งอนาคตพวกกูกับบวชพี่มึงอะไรสำคัญกว่า ตลาด ล่าง นักใช่มั้ยมึงมานี่!!!มึงลองมาเรียนหนังสือหน้าดำหน้าแดง3ปีเพื่อไปสอบข้อสอบที่พวกกูก็ทำไม่ได้ แล้วมึงจะได้รู้เลวร้ายกว่านอนคุกคือการนอนอยู่ในคุกกับหนังสือฟิสิกต์เคมีชีวะดาราศาสตร์และบลาๆๆ #วัดสิงห์ https:// twitter.com/Prasertsak_Pad /status/1099665478392266752 …,,,#,1099971938124947456,https://twitter.com/juoonkung/status/1099971938124947456
BassZaz,2019-02-25 16:58,0,0,,55555555555 ตลาดล่าง ก็คือ ตลาดล่าง สมเพชเวทนาแท้ๆ #วัดสิงค์ pic.twitter.com/LnPwhYSVnx,,,#,1099971886069440512,https://twitter.com/BassZaz/status/1099971886069440512
pun234pay234_h,2019-02-25 16:53,0,0,4,อีพวก ตลาดล่าง อีดอกอีคนชนชั้นต่ำสุดของประเทศไทย http:// news.ch7.com/detail/328548,,,,1099970710519173122,https://twitter.com/pun234pay234_h/status/1099970710519173122
Tlenerrr,2019-02-25 16:53,0,0,,ไม่รู้จะหัวร้อนเรื่องป็อปก่อนรึพวก ตลาดล่าง ก่อนดีเนี่ย,,,,1099970623030226944,https://twitter.com/Tlenerrr/status/1099970623030226944
CCHb04050405,2019-02-25 16:52,0,4,,ตลาดล่าง,,,,1099970420151730176,https://twitter.com/CCHb04050405/status/1099970420151730176
LuvSubsorn,2019-02-25 16:51,0,0,,สุดคือสร้างความเดือดร้อน ใช้กฏหมู่สังคม ตลาดล่าง เหมือนสัตว์ป่า เหมือนเหี้ยไรก็ไม่รู้ รู้แต่เหี้ยมาก ปท ไทยเมืองพุทธ แต่ดูน่ากลัวขึ้นทุกวัน ไม่รู้คุกจะเต็มก่อน หรือเด็กไทยที่อยู่ชนชั้นแบบนี้จะได้รับการศึกษาทุกคนก่อนแน่ #พรรคอนาคตใหม่ มีอะไรเสนอเรื่องการศึกษาตรงนี้ไหม ฝากให้คิดด้วย,,,#,1099970233224200192,https://twitter.com/LuvSubsorn/status/1099970233224200192
Caoutchouc1021,2019-02-25 16:51,0,0,,ต้องล้มท่าไหนถึงแขนหักขนาดนั้น อี ตลาดล่าง,,,,1099970174235471874,https://twitter.com/Caoutchouc1021/status/1099970174235471874
zylliz_h,2019-02-25 16:50,0,0,,อยากเรียนจบมีงานทำแล้วออกจากประเทศนี้ เพราะกูไม่อยากอยู่กับคน ตลาด ล่าง อีเว๊รรรร,,,,1099969991711936512,https://twitter.com/zylliz_h/status/1099969991711936512
cottonnuna,2019-02-25 16:50,0,1,,ข่าว ตลาดล่าง มีปัญหามาสองข่าว แล้วแต่ละข่าวน่ากลัวมากอะ จะมีใครจัดการเรื่องนี้ได้จริงๆจังสักที;-; #วัดสิงห์,,,#,1099969930563223552,https://twitter.com/cottonnuna/status/1099969930563223552
SinSin_Devil,2019-02-25 16:50,0,1,,ไม่ต้องถามหรอกค่ะว่าเกิดและโตมาแบบไหน เกิดแบบไม่ตั้งใจให้เกิด และโตมาในสังคม ตลาดล่าง น่ะเอง,,,,1099969851504771073,https://twitter.com/SinSin_Devil/status/1099969851504771073
ArsrNice,2019-02-25 16:47,0,0,,วันๆไม่ทำอะไร เอาแต่นั่งแซะ นั่งแขวะคนอื่นว่าเป็นสก๊อย ตลาด ล่าง ตัวเอง ตลาด บนมาจากไหนวะน่ะ,,,,1099969126645125121,https://twitter.com/ArsrNice/status/1099969126645125121
somwangjack,2019-02-25 16:47,0,0,,ตลาดล่าง ดูสูงไป,,,,1099969118948679680,https://twitter.com/somwangjack/status/1099969118948679680
BeammuSin,2019-02-25 16:47,0,0,,ก็ ตลาดล่าง พยายามซื้ออะไรเกินงบตัวเอง เค้าเลยมองว่าแพง,,,,1099969065878093824,https://twitter.com/BeammuSin/status/1099969065878093824
dontbesobad_,2019-02-25 16:46,0,0,,บางทีก็คือ ตลาดล่าง ด่า ตลาดล่าง งงในงง,,,,1099968982637920257,https://twitter.com/dontbesobad_/status/1099968982637920257
kyobangkoku,2019-02-25 16:44,11,15,,การจะบวชไม่จำต้องเยอะ! #ตลาด ล่าง #ต่ำตม #pat5 #GATPAT #โจ๋งานบวช #วัดสิงห์ #งานบวช #สาธุ #ตัวอย่างดีๆ pic.twitter.com/r7xc2vF2YX,,,# # #pat5 #GATPAT # # # # #,1099968489467502593,https://twitter.com/kyobangkoku/status/1099968489467502593
woranunjiean,2019-02-25 16:43,0,0,,สอบใหม่เพราะพวกมึงอะสำนึกไหมไอ้ควาย ตลาดล่าง โง่ ขยะ! https:// twitter.com/SanookNews/sta tus/1099965595955515392 …,,,,1099968232008515584,https://twitter.com/woranunjiean/status/1099968232008515584
Pontita2,2019-02-25 16:41,0,0,4,เปิดวาปอีปัญญานิ่มนี้ที โง่ในโง่ พวก ตลาดล่าง,,,,1099967679178235904,https://twitter.com/Pontita2/status/1099967679178235904
Tw_FaH,2019-02-25 16:41,7,3,,คำว่า ตลาดล่าง มันยังน้อยไปสำหรับพวกคุณ #วัดสิงค์ https:// twitter.com/sn_nueng/statu s/1099960202214817792 …,,,#,1099967611767418881,https://twitter.com/Tw_FaH/status/1099967611767418881
daddy__crow,2019-02-25 16:40,4,0,,ส่วนตัวว่าการลดหย่อนภาษีไม่น่าเกี่ยวกับคุณภาพประชากร เพราะถ้าดูดีๆแล้วพวก ตลาดล่าง ไม่น่าจะเคยจ่ายภาษีด้วยซ้ำ ไม่ว่าจะไม่ถึงเกณฑ์ต้องจ่าย หรือที่หนักกว่าคือไม่เคยแสดงที่มาของรายได้เลย ดังนั้นต่อให้มีหรือไม่มีลดหย่อนภาษีออกมา คนที่ไม่ได้จ่ายตั้งแต่แรกก็ไม่สะเทือนอยู่ดี https:// twitter.com/TAXBugnoms/sta tus/1099714725019959299 …,,,,1099967327066456064,https://twitter.com/daddy__crow/status/1099967327066456064
ygtp_r,2019-02-25 16:39,3,1,,"แด่พวกมึงขยะสังคมในวันนี้ กูบอกเลยว่า ใช้คำว่า เหี้ย"" ได้เปลืองจริงๆ ขอบคุณค่ะ #วัดสิงห์ #dek62 #GATPAT #dek63 #ประเทศกูมี #ตลาดล่าง https:// twitter.com/VsaveHogwarts/ status/1099897075766939648 …""",,,# #dek62 #GATPAT #dek63 # #,1099967060061253633,https://twitter.com/ygtp_r/status/1099967060061253633
HorNorKor,2019-02-25 16:39,0,0,,เถียงกับคนเอ๋อยังไม่เหนื่อยเท่าเถียงกับ ตลาดล่าง ที่ไม่รู้ว่าตัวเองเป็น ตลาดล่าง แนะนำไปซื้อกระทิงแดงมาแดกนะคะ เผื่อจะตื่นมาเจอความจริง,,,,1099967042944290821,https://twitter.com/HorNorKor/status/1099967042944290821
li_2cangicxl,2019-02-25 16:38,7,0,,กูอยากรู้มากว่าแบ้คของพวกแม่งคือใคร กูตะด่ากราดใหอีโง่ นักการเมืองพวกนั้นต้องมีฐานเสียงมาจากพวก ตลาดล่าง แสดงว่าห่วยมากเพราะไม่มีฐานเสียงหลักจากปัญญาชน #วัดสิงห์,,,#,1099966879542607874,https://twitter.com/li_2cangicxl/status/1099966879542607874
SiazMei,2019-02-25 16:37,0,0,,ถึงตัวจะเป็นผู้ใหญ่แต่สมองยังเป็นเด็ก พวกเขาคือ...เหล่า ตลาดล่าง ล่าง ล่าง ล่าง pic.twitter.com/rKDMh9jmhs,,,,1099966729533349888,https://twitter.com/SiazMei/status/1099966729533349888
ITSKAXXI,2019-02-25 16:36,6,7,,พวกมึงไม่รู้รึไงว่าอิพวกเด็กเรียนเช่นกูเขาก็ดูหนังโป๊อ่านโดจินกัน ไม่ได้อ่านแต่หนังสือ เรียนพิเศษตั้งแต่เช้าจนมืด แต่เขาไม่ทำกิริยามารยาทต่ำเช่นการเต้นร่อนหี ไม่แว๊นรถ ไม่ทำตัวเป็นขยะสังคมเหมือนพวกมึง #ตลาด ล่าง #วัดสิงห์,,,# #,1099966462620385281,https://twitter.com/ITSKAXXI/status/1099966462620385281
