username,date,retweets,favorites,label,text,geo,mentions,hashtags,id,permalink
ttaa_mo,2019-02-25 15:24,1,3,,นโยบายเกิดปั๊บรับแสน เนี่ย คิดใหม่นะ ไม่ไหวๆ เพิ่มประชากร ตลาดล่าง แน่ๆ แย่ว่ะ #วัดสิงห์,,,#,1099948157062938624,https://twitter.com/ttaa_mo/status/1099948157062938624
kaiismall,2019-02-25 15:24,0,0,,มีลูกลูกก็จะ ตลาดล่าง ต่อไปเรื่อยๆ ไม่จบไม่สิ้น อินฟินิตี้ออฟความ ตลาดล่าง https:// twitter.com/jeanxmha/statu s/1099870998701035520 …,,,,1099948133008605185,https://twitter.com/kaiismall/status/1099948133008605185
ThenoomO,2019-02-25 15:23,0,0,,ตลาดล่าง ก็คือ ตลาดล่าง ต่ำตมไปถึงโคตรถึงตระกูล https:// twitter.com/__paanthita/st atus/1099927131931389953 …,,,,1099947964733186049,https://twitter.com/ThenoomO/status/1099947964733186049
Pailinpan,2019-02-25 15:22,8,0,4,ไม่ได้อยากจะเหยียด แต่ต้องบอกเลยจริงๆเลย พวกคน ตลาดล่าง มันก็จะเป็นได้แค่ ตลาดล่าง จริงๆ ไม่มีวันที่จะได้อยู่เหนือน้ำ มีลูกแล้วเลี้ยงให้เป็นคนคุณภาพไม่ได้ ก็อย่าผสมพันธุ์กันเลย #วัดสิงห์,,,#,1099947825238990848,https://twitter.com/Pailinpan/status/1099947825238990848
bee_lamon,2019-02-25 15:22,0,0,,ดูรอยสักบ่งบอกยี่ห้อเลยค่ะ ตลาดล่าง มาก,,,,1099947689708376064,https://twitter.com/bee_lamon/status/1099947689708376064
radaphat1504,2019-02-25 15:21,2,2,,บางประโยคก็ไม่เข้าใจนะ แบบ ตลาดล่าง ขยะ คนพวกนี้คนพวกนั้น สาเหตุของปัญหาส่วนหนึ่งก็เกิดจากการเเบ่งชนชั้น การไม่เข้าใจกัน ไม่ยอมรับกัน ทำให้พวกเขาต้องสร้างสังคมของตัวเองเพื่อให้เกิดการยอมรับอีกทางหนึ่ง พวกเขาผิดเรารู้ค่ะ ผิดมากด้วย แต่ก็ไม่อยากเห็นความคิดในเชิงเหยียดหยาม #วัดสิงห์,,,#,1099947557742997504,https://twitter.com/radaphat1504/status/1099947557742997504
socialclasswar,2019-02-25 15:21,0,0,,#ตลาดล่าง #พลเมืองขยะ,,,# #,1099947498179710977,https://twitter.com/socialclasswar/status/1099947498179710977
rainnyrain4,2019-02-25 15:19,18,9,4,ใครก็ได้ไปล่าข้อมูลของอีคนแทงมา อีชะนีโง่นั้นด้วยอยากจะด่ากราดดด สงสารคนดีๆต้องมาตาย โดนดับอนาคตอันสวยหรู พ่อแม่เค้าจะเป็นยังไงบ้างอีพวก ตลาดล่าง ก็คงไม่สนใจ #ปทุมคงคา,,,#,1099946940186292224,https://twitter.com/rainnyrain4/status/1099946940186292224
Kimif91,2019-02-25 15:18,9,0,,อนาคตของชาติ ต้องมาเสียแค่ไอ้พวก ตลาดล่าง แบบนี้หรอว่ะ มีทำร้ายร่างกาย ข่มขู่เด็ก แค่เงิน2หมื่นอีดอกทำเป็นจะตาย แล้วเด็กที่เขาเสียหายหละทั้งประเทศกี่ล้านบาทเกาหลีใต้เด็กสอบเครื่องบินยังต้องหยุดบินเลย ถนนบางส่วนปิดช่องทางจราจร พวกมึงไม่มีอนาคตแล้ว เด็กมันยังต้องการอนาคต #วัดสิงห์,,,#,1099946716223004673,https://twitter.com/Kimif91/status/1099946716223004673
kkrich168,2019-02-25 15:17,1,0,,เพื่อนเราคนจีน2คนสามีภรรยา หน้าที่การงานดี เงินเดือนรวมกัน3แสนกว่า นางบอกยังไม่พร้อมมีลูกปีนี้ ขอทำงานเก็บเงินให้มากๆก่อนเพื่ออนาคตของลูกที่จะเกิดมา.. และตัดภาพกลับมาประชากร ตลาด ล่าง ในประเทศกู https:// twitter.com/kanchouene/sta tus/1099627898581901312 …,,,,1099946480775774210,https://twitter.com/kkrich168/status/1099946480775774210
nood_rider,2019-02-25 15:17,0,1,"2,4",ตลาดล่าง ? นึกว่าสัตว์นรก,,,,1099946359367512064,https://twitter.com/nood_rider/status/1099946359367512064
ppppingss,2019-02-25 15:16,0,0,,ฮือ5555555555พี่แบม5555555555ฮือแลงมาก แต่จริงเลยㅠㅠ หนูเป็นร้องไห้อ่ะแบบ ร้องไห้!! ไม่ไหวแล้ว ตลาดล่าง เยอะมาก อุจาดตาเด้อ ไม่ไหวๆๆๆๆๆ,,,,1099946334792998918,https://twitter.com/ppppingss/status/1099946334792998918
yeolchanchanyc,2019-02-25 15:16,0,0,"2,4",อี ตลาดล่าง อีพวกเหี้ย ทำเหี้ยไรไม่คิด หยี๋ๆ,,,,1099946282028658688,https://twitter.com/yeolchanchanyc/status/1099946282028658688
apmt936,2019-02-25 15:16,0,0,,ทำเค้าวุ่นวายกันทั้งประเทศ เพราะความ ตลาด ล่าง ของพวกมึงเนี้ยยย,,,,1099946108665524224,https://twitter.com/apmt936/status/1099946108665524224
Nest_bi,2019-02-25 15:15,0,0,,ตลาดล่าง สุดๆกูไม่รุจะด่าพวกมึงยังไงละอิดหี้ยยววว,,,,1099946054613528577,https://twitter.com/Nest_bi/status/1099946054613528577
thekoploveking,2019-02-25 15:15,0,0,,เปิด 20 รายชื่อ “แก๊งงานบวช ตลาดล่าง ” ป่วนสนามสอบ GAT/PAT พระบวชใหม่ระส่ำ อยากสึกตั้งแต่เมื่อคืน https:// mgronline.com/onlinesection/ detail/9620000019408 …,,,,1099945954243792897,https://twitter.com/thekoploveking/status/1099945954243792897
mildnikaa,2019-02-25 15:13,0,0,,อยากจะโพสเพื่อให้ตัวเองดูสูงกว่า แต่ขอโทษนะคะแค่คุณโพสเหยียด ตลาด บน ก็ดูต่ำกว่า ตลาด ล่าง แล้วค่ะ https:// twitter.com/ppthati/status /1099927685587886080 …,,,,1099945545504776193,https://twitter.com/mildnikaa/status/1099945545504776193
TiaInw,2019-02-25 15:13,0,0,,วัยรุ่น ตลาดล่าง น่าจะเน้นยาบ้ามากกว่ากัญชากระมังคะ? ถถถถ,,,,1099945505826557952,https://twitter.com/TiaInw/status/1099945505826557952
Sepimnapas,2019-02-25 15:13,0,0,,นายกคนไหนแก้ปัญหาพวก ตลาดล่าง ได้บ้าง กูจะเลือก,,,,1099945428022321152,https://twitter.com/Sepimnapas/status/1099945428022321152
babababanat,2019-02-25 15:13,0,0,,จริงๆต้องเลิกสักที แคปชั่น 'เป็นลูกที่แย่ แต่จะเป็นแม่ที่ดี' เพราะผลิตแต่คนคุณภาพ ตลาดล่าง ออกมาจัง เธอต้องมีลูกเมื่อพร้อมสิ่ ให้สมกับที่จะเป็นแม่ที่ดี,,,,1099945385991139328,https://twitter.com/babababanat/status/1099945385991139328
N_J_MER,2019-02-25 15:13,0,0,,ตลาดล่าง https:// twitter.com/jeanxmha/statu s/1099870998701035520 …,,,,1099945374591012864,https://twitter.com/N_J_MER/status/1099945374591012864
Yhserf15,2019-02-25 15:13,0,0,,ตลาดล่าง คือน้อยไป แบบนี้จัดอยู่ใต้ดินเถอะ อีเวร! #วัดสิงห์,,,#,1099945366252793856,https://twitter.com/Yhserf15/status/1099945366252793856
faabbiifa,2019-02-25 15:10,0,1,,คนแบบนี้มันคิดว่าสิ่งที่มันทำคือเท่ห์จ้าาา อยากดังอยากเด่นทำๆไปเดี๋ยวออกมาขอโทษจบๆคนลืม แต่ไม่นะแกแกคิดผิด อย่าโง่ ตลาด ล่าง จริงๆ #วัดสิงค์,,,#,1099944807445671936,https://twitter.com/faabbiifa/status/1099944807445671936
rainnyrain4,2019-02-25 15:09,0,0,"2,4",อีขยะโลก หน้าหี อีชะนีก็ไม่ห้ามผัว ตลาดล่าง มึงเนอะ เลวมาก https:// twitter.com/Nalinee_OPLE/s tatus/1099652851200978947 …,,,,1099944393815994368,https://twitter.com/rainnyrain4/status/1099944393815994368
bluvieee,2019-02-25 15:08,0,1,,อ่านแล้วอยากอ้วกอะ ไม่อยากดูถูก ตลาดล่าง แต่แบบ มุงคอนทีนิวทูสร้างภาระให้ประเทศมากอะ รับมั่ยดั้ย,,,,1099944262429331456,https://twitter.com/bluvieee/status/1099944262429331456
Sakura189307,2019-02-25 15:07,7,1,,เห็นประโยคนี้แล้วเเบ่บ.. ไม่รู้จะรู้สึกโกรธ หงุดหงิด โมโห ขำในความไม่มีจิตสำนึกหรือสงสารที่โตมาแล้วมีความคิดแบบนี้ดี คือไม่ได้รู้สึกผิดกันทั้งโคตรเลยอ่ะค่ะ สิ้นหวังแล้วจริงๆ ตลาด ล่าง ประเทศนี้ #วัดสิงห์ #pat5 pic.twitter.com/MSxOUEZ4NE,,,# #pat5,1099944053938900993,https://twitter.com/Sakura189307/status/1099944053938900993
Nammhyun,2019-02-25 15:07,1,1,,ตายแน่ อนาคตถ้าคนไทยไม่ตายเพราะ ตลาดล่าง ก็ตายเพราะเชื้อดื้อยา,,,,1099943984158261248,https://twitter.com/Nammhyun/status/1099943984158261248
Nnutqy,2019-02-25 15:07,40,1,,พรรคไหนมีนโยบายเซ็ตซีโร่พวก ตลาดล่าง ขยะสังคม กูเลือกเลย,,,,1099943980823789569,https://twitter.com/Nnutqy/status/1099943980823789569
nu3ngg,2019-02-25 15:07,0,0,,ตลาดล่าง ล้นประเทศ55555,,,,1099943950196961280,https://twitter.com/nu3ngg/status/1099943950196961280
hunpw,2019-02-25 15:07,0,0,,"คำว่า ตลาดล่าง ""ไม่ใช่การบูลลี่ฐานะความเป็นอยู่ของคน . . แต่เป็นการบูลลี่สันดานต่ำๆของคนบางจำพวกต่างหาก #วัดสิงค์""",,,#,1099943929653252096,https://twitter.com/hunpw/status/1099943929653252096
sakurakok9,2019-02-25 15:07,0,0,,เพราะไอพวก ตลาดล่าง LV.1 https://www. facebook.com/story.php?stor y_fbid=2044659555589455&id=100001362904754 …,,,,1099943926864068609,https://twitter.com/sakurakok9/status/1099943926864068609
GongHello,2019-02-25 15:06,719,226,,“ ตลาดล่าง ” ถือเป็นชนชั้นที่เรียกได้ว่า ต่ำสุดของสังคมไทยตอนนี้ เลยก็ว่าได้ เชื่อว่าการเหยียดไม่ดี แต่จากเหตุการณ์ต่างๆที่เกิดขึ้นจากความไม่ยั้งคิดของคนเหล่านี้ ก็สมควรแล้วที่ต้องโดนเรียกว่า ตลาดล่าง ต่อไป! จมไปกับความต่ำช้าของตัวเองเถอะ #วัดสิงค์,,,#,1099943806521171969,https://twitter.com/GongHello/status/1099943806521171969
Y_keizuke,2019-02-25 15:06,0,0,,ตลาดล่าง ก็ยังคงความต่ำตมต่อไป https://www. facebook.com/10000633367242 3/posts/2350184778535955/ …,,,,1099943749021503488,https://twitter.com/Y_keizuke/status/1099943749021503488
LuckYouBean,2019-02-25 15:06,2,1,,#บุกโรงเรียนวัดสิงห์ #วัดสิงห์ #GATPAT #โรงเรียนวัดสิงห์ #งานบวช #วัยรุ่น #ลดเสียง #สอบ #pat5 #ถึงตัวจะเป็นผู้ใหญ่แต่สมองยังเป็นเด็ก #บวชกับหลวงพ่อไม่ได้บวชกับลำโพง #ตลาดล่าง #เลว #ระยำ pic.twitter.com/eSlBE5Hbav,,,# # #GATPAT # # # # # #pat5 # # # # #,1099943636161032199,https://twitter.com/LuckYouBean/status/1099943636161032199
mildnikaa,2019-02-25 15:06,0,0,,ตลาดล่าง ที่แท้ ตระกะแบบนี้มีแค่พวกอเธอนั่นแหละ https:// twitter.com/meawsiberia/st atus/1099869674026586115 …,,,,1099943601620963328,https://twitter.com/mildnikaa/status/1099943601620963328
27oct__,2019-02-25 15:03,0,0,,ตลาดล่าง ซ้ำซ้อนอะไรขนาดนี้,,,,1099942929827651584,https://twitter.com/27oct__/status/1099942929827651584
NongBik,2019-02-25 15:02,3,1,,"ตลาดล่าง เค้าไม่ได้หมายถึงฐานะ นะ เค้าหมายถึง สันดาน"" #วัดสิงห์""",,,#,1099942772239261696,https://twitter.com/NongBik/status/1099942772239261696
vampireboy38,2019-02-25 15:02,0,0,,พักข่าว ตลาดล่าง แป๊บ ง่วง,,,,1099942758897176576,https://twitter.com/vampireboy38/status/1099942758897176576
KurtisSeraphim,2019-02-25 15:01,14,3,,เห็นพวก ตลาดล่าง ที่ออกมาปกป้องพวกร่วมสปีชีส์หรือออกมาด่าเรื่องที่น้องๆเขาสอบเอาวันเสาี์ อาทิตย์ ก็อยากให้เขาไปช่วยชดใช้ค่าเสียหาย ค่าพยายาล ค่าทำขวัญ ค่าเสียเวลาในชีวิต ค่าคอรส์เรียนพิเศษ และอาจจะรวมถึงค่าสมัครสอบ ค่าจัดตั้งการสอบ ค่าเดินทางมาสอบใหม่อีก จะได้เลิกซ่า #วัดสิงห์,,,#,1099942561689460737,https://twitter.com/KurtisSeraphim/status/1099942561689460737
phybby,2019-02-25 15:01,12,7,,"คือมึงคิดบ้างไหมอะ ที่มึงทำอะมันจะสร้างความเสียหายระดับประเทศขนาดไหน มึงบอกให้เลื่อนสอบได้ไหม? อะ!งั้นมึงจ่ายค่าเสียหายและค่าสอบแพทของนักเรียนทั้งประเทศได้หรือป้ะ? มันเทียบได้กับแตรวง20,000มึงป้ะ? คิดหน่อยดิ โคตร ตลาด ล่าง การศึกษาเลย.. #GATPAT #pat5 #วัดสิงห์",,,#GATPAT #pat5 #,1099942419917762560,https://twitter.com/phybby/status/1099942419917762560
snappz_b,2019-02-25 15:01,1,2,,เป็นประเภท ตลาดล่าง ที่อยากจะเทิร์นตัวเองให้ดูสูง แต่ทำไม่ถึงสินะ ซื้อข้าวในห้าง ข้าวบูดถูกมะ เลยส่งผลให้เป็นคนแบบนี้,,,,1099942401286627328,https://twitter.com/snappz_b/status/1099942401286627328
dewdewdww,2019-02-25 15:00,0,0,,อะไหนอิพรรคการเมืองทั้งหลาย ลองเสนอแนวทางแก้ไขประชากร ตลาดล่าง ซิ,,,,1099942276631977984,https://twitter.com/dewdewdww/status/1099942276631977984
Tomezong1,2019-02-25 14:59,0,0,,ตลาดล่าง ที่แท้ทรู,,,,1099941931088412672,https://twitter.com/Tomezong1/status/1099941931088412672
echaxnabo,2019-02-25 14:57,0,0,,ตลาดล่าง เลเวลไรดี... เหน่ยกับคนแบบนี้,,,,1099941535586512896,https://twitter.com/echaxnabo/status/1099941535586512896
Jennykht_,2019-02-25 14:57,12,8,,อยู่ในประเทศที่ปากบอกประชาธิปไตย แต่ตำรวจให้ถอนแจ้งความ ประเทศแห่งเมืองพุทธ จัดงานบวช บุกสถานที่ราชการทำร้ายคุกคาม ลวนลามผญ. ประเทศที่บอกเด็กคืออนาคตของชาติ แต่บอกว่าให้เลื่อนสอบ ประเทศที่จะผลิตเด็กให้มีอนาคต แต่พวก ตลาด ล่าง เต็มไปหมด ที่นี่ประเทศไทย #วัดสิงห์,,,#,1099941392158056449,https://twitter.com/Jennykht_/status/1099941392158056449
Namwaan161,2019-02-25 14:57,0,0,,ขำแบบย้องแย้งมากพวกที่กล่าวหาคนอื่นว่า ตลาด ล่าง นี่พอดูนิสัย ความคิด วิธีการด่าเราก็นึกว่าพวก ตลาด ล่าง ด่ากันเอง,,,,1099941351150342144,https://twitter.com/Namwaan161/status/1099941351150342144
aumpher,2019-02-25 14:56,0,0,,ก้อย เธอดูรายการ ตลาดล่าง แบบนี้ด้วยหรอ,,,,1099941230136373250,https://twitter.com/aumpher/status/1099941230136373250
socialclasswar,2019-02-25 14:55,2,1,,ไม่ต้องดูไรมาก พวกมอไซค์บนทางเท้า มีกี่เปอร์เซ็นที่เป็นคน #กทม แท้ๆ ดูป้ายทะเบียนร่วมด้วยก็ได้ จอดเรียงไล่ดูมีแต่ทะเบียน #ตจว . #ตลาดล่าง #วัดสิงห์ #การศึกษาไทย #นี่หรือเมืองพุทธ #ฟ้ารักพ่อ,,,# # # # # # #,1099940875017175040,https://twitter.com/socialclasswar/status/1099940875017175040
yuwanda_d,2019-02-25 14:55,3,3,,จะส่งข่าวบอกพวก ตลาดล่าง ยังไงให้เข้าใจดีว่า วิธีคุมกำเนิดแบบนี้มันดีกว่าถุงยาง มึงสดได้ไม่ต้องกลัวแต่ถ้ามั่ว sex ด้วย ก็ทั้งฝังทั้งถุงไปเลย #pat5 #วัดสิงห์ https:// twitter.com/mddincafe/stat us/1099907390374260736 …,,,#pat5 #,1099940865554866181,https://twitter.com/yuwanda_d/status/1099940865554866181
kpjw37,2019-02-25 14:55,0,0,,ตลาดล่าง แหวะ,,,,1099940813440577537,https://twitter.com/kpjw37/status/1099940813440577537
AmNan34986187,2019-02-25 14:54,21,5,,ไม่มีใครว่าคุณว่า ตลาดล่าง เพราะคุณกินอะไร แต่ที่คนอื่นพูดเขาหมายถึงการกระทำของคุณต่างหากที่มันตลาดล่าง #วัดสิงห์ https:// twitter.com/PpThati/status /1099927685587886080 …,,,#,1099940687108161536,https://twitter.com/AmNan34986187/status/1099940687108161536
Mingnuneo,2019-02-25 14:54,0,0,,ก็คนประเภทเดียวกันมันเลยจูนเข้าหากันได้ไง ขยะ ตลาดล่าง https:// twitter.com/loststarrrrray /status/1099920977872310272 …,,,,1099940591851298816,https://twitter.com/Mingnuneo/status/1099940591851298816
eineye98,2019-02-25 14:53,0,0,,แกคิดดูถ้าประเทศมีปรายุดเป็นนายกแล้วมีแต่อิพวก ตลาดล่าง อยู่ในปกครองคิดว่าประเทดนั้นจะชิบหายขนาดไหน55555555565,,,,1099940378059276288,https://twitter.com/eineye98/status/1099940378059276288
BarBeh_official,2019-02-25 14:53,0,0,,ไม่อยากเรียกแม่แล้วตรงๆ รู้สึกแม่เป็นคนพวกเดียวกับ ตลาดล่าง ว่ะนาย,,,,1099940362720706561,https://twitter.com/BarBeh_official/status/1099940362720706561
938bdui,2019-02-25 14:52,66,21,,กินข้าวมื้อหนึ่งที่เท่ากับเงินเดือน ตลาดล่าง ทั้งเดือนอ่ะ,,,,1099940130524020736,https://twitter.com/938bdui/status/1099940130524020736
Polarris_,2019-02-25 14:52,8,1,,เจอคนเเคปเฟสของ ตลาดล่าง ที่วิจารณ์เรื่องนี้ คือเเบบอยากเบ้ปากใส่มาก อ้างโน่นนี้ว่าทำไมไม่สอบวันธรรมดา บวชก็ต้องเสียงดัง เเค่หอมเเก้ม ขยะเเขยงวะคนพวกนี้คือไม่รู้หนังสือไม่พอยังมีค่านิยมผิดๆเเละกร่างไปทั่วอีก เเล้วไปทำเด็กที่กำลังมีอนาคต ใฝ่เรียนอีก #วัดสิงห์,,,#,1099940122559008769,https://twitter.com/Polarris_/status/1099940122559008769
iinewz,2019-02-25 14:51,0,0,,อิชะนีพวกนี้อะน่าเอาไม้มาตีฮี อิดอกกกกก ตีซ้ำๆๆๆๆๆๆๆๆๆๆ เอาให้ไม่ต้องใช้การได้ไปเลย โอ้ยยยยยย ตลาด ล่าง สุดๆ อ่านแล้วโกรธ ความดันจะขึ้น อิเวรเอ้ยยยย,,,,1099940020637450241,https://twitter.com/iinewz/status/1099940020637450241
LukIDok,2019-02-25 14:49,135,46,,นี้สินะ ตลาดล่าง #วัดสิงค์ pic.twitter.com/fszr0g502s,,,#,1099939366669934593,https://twitter.com/LukIDok/status/1099939366669934593
goodzloli,2019-02-25 14:48,2,0,,การล้างเผ่าพันธุ์พวก ตลาดล่าง เป็นทางออกที่เหมาะสมที่สุด,,,,1099939233198821376,https://twitter.com/goodzloli/status/1099939233198821376
mirinbuu93,2019-02-25 14:45,5,2,,ความน่าสงสารในอนาคตของไทยแลนด์คือคนฐานะดีๆมีวุฒิภาวะทางสังคมเห็นสภาพสังคมแล้วมีลูกกันน้อยลง ในขณะที่พวก ตลาดล่าง ผุดลูกผุดหลานสืบออกมาเป็นว่าเล่น จินตนาการถึงอนาคตแล้วแบบเฮ้ออออ,,,,1099938533249175552,https://twitter.com/mirinbuu93/status/1099938533249175552
pandoraznp_,2019-02-25 14:45,0,0,,ตลาดล่าง is ตลาดล่าง งงงง ต่ำสุดๆเลยเว้ยแก,,,,1099938362905882624,https://twitter.com/pandoraznp_/status/1099938362905882624
